<?xml version="1.0" encoding="UTF-8"?>


<root xmlns:xsi="http://www.w3.org/2001/XMLSchema-instance" xsi:noNamespaceSchemaLocation="XMLSchemaB00P5Y.xsd">
    <allatok>
        <allat aid="a-1" eid="e-5">
            <nev>Pihe</nev>
            <nem>Hím</nem>
            <faj>
                <orszag>Állatok</orszag>
                <torzs>Gerinchúrosok</torzs>
                <osztaly>Emlősök</osztaly>
                <rend>Ragadozók</rend>
                <csalad>Macskafélék</csalad>
                <faj>Vadmacska</faj>
            </faj>
            <szuletes-ideje>
                2021.04.20.
            </szuletes-ideje>
        </allat>
        <allat aid="a-2" eid="e-5">
            <nev>Cirmi</nev>
            <nem>Nőstény</nem>
            <faj>
                <orszag>Állatok</orszag>
                <torzs>Gerinchúrosok</torzs>
                <osztaly>Emlősök</osztaly>
                <rend>Ragadozók</rend>
                <csalad>Macskafélék</csalad>
                <faj>Vadmacska</faj>
            </faj>
            <szuletes-ideje>
                2021.08.19.
            </szuletes-ideje>
        </allat>
        <allat aid="a-3" eid="e-3">
            <nev>Füles</nev>
            <nem>Hím</nem>
            <faj>
                <orszag>Állatok</orszag>
                <torzs>Gerinchúrosok</torzs>
                <osztaly>Emlősök</osztaly>
                <rend>Ragadozók</rend>
                <csalad>Kutyafélék</csalad>
                <faj>Farkas</faj>
            </faj>
            <szuletes-ideje>
                2016.05.11.
            </szuletes-ideje>
        </allat>
        <allat aid="a-4" eid="e-3">
            <nev>Vadóc</nev>
            <nem>Nőstény</nem>
            <faj>
                <orszag>Állatok</orszag>
                <torzs>Gerinchúrosok</torzs>
                <osztaly>Emlősök</osztaly>
                <rend>Ragadozók</rend>
                <csalad>Kutyafélék</csalad>
                <faj>Farkas</faj>
            </faj>
            <szuletes-ideje>
                2017.08.30.
            </szuletes-ideje>
        </allat>
        <allat aid="a-5" eid="e-3">
            <nev>Vadóc</nev>
            <nem>Nőstény</nem>
            <faj>
                <orszag>Állatok</orszag>
                <torzs>Gerinchúrosok</torzs>
                <osztaly>Emlősök</osztaly>
                <rend>Ragadozók</rend>
                <csalad>Kutyafélék</csalad>
                <faj>Farkas</faj>
            </faj>
            <szuletes-ideje>
                2017.08.30.
            </szuletes-ideje>
        </allat>
        <allat aid="a-6" eid="e-2">
            <nev>Béla</nev>
            <nem>Him</nem>
            <faj>
                <orszag>Állatok</orszag>
                <torzs>Gerinchúrosok</torzs>
                <osztaly>Emlősök</osztaly>
                <rend>Párosujjú patások</rend>
                <csalad>Disznófélék</csalad>
                <faj>Vaddisznó</faj>
            </faj>
            <szuletes-ideje>
                2016.10.26.
            </szuletes-ideje>
        </allat>
        <allat aid="a-7" eid="e-2">
            <nev>Barnabás</nev>
            <nem>Him</nem>
            <faj>
                <orszag>Állatok</orszag>
                <torzs>Gerinchúrosok</torzs>
                <osztaly>Emlősök</osztaly>
                <rend>Párosujjú patások</rend>
                <csalad>Disznófélék</csalad>
                <faj>Vaddisznó</faj>
            </faj>
            <szuletes-ideje>
                2016.10.26.
            </szuletes-ideje>
        </allat>
        <allat aid="a-8" eid="e-2">
            <nev>Cecília</nev>
            <nem>Nőstény</nem>
            <faj>
                <orszag>Állatok</orszag>
                <torzs>Gerinchúrosok</torzs>
                <osztaly>Emlősök</osztaly>
                <rend>Párosujjú patások</rend>
                <csalad>Disznófélék</csalad>
                <faj>Vaddisznó</faj>
            </faj>
            <szuletes-ideje>
                2015.12.03.
            </szuletes-ideje>
        </allat>
        <allat aid="a-9" eid="e-2">
            <nev>Jessica</nev>
            <nem>Nőstény</nem>
            <faj>
                <orszag>Állatok</orszag>
                <torzs>Gerinchúrosok</torzs>
                <osztaly>Emlősök</osztaly>
                <rend>Párosujjú patások</rend>
                <csalad>Disznófélék</csalad>
                <faj>Vaddisznó</faj>
            </faj>
            <szuletes-ideje>
                2018.01.26.
            </szuletes-ideje>
        </allat>
        <allat aid="a-10" eid="e-1">
            <nev>Totyi</nev>
            <nem>Hím</nem>
            <faj>
                <orszag>Állatok</orszag>
                <torzs>Gerinchúrosok</torzs>
                <osztaly>Madarak</osztaly>
                <rend>Pingvinalakúak</rend>
                <csalad>Pingvinfélék</csalad>
                <faj>Császárpingvin</faj>
            </faj>
            <szuletes-ideje>
                2011.05.11.
            </szuletes-ideje>
        </allat>
        <allat aid="a-11" eid="e-1">
            <nev>Tipegő</nev>
            <nem>Hím</nem>
            <faj>
                <orszag>Állatok</orszag>
                <torzs>Gerinchúrosok</torzs>
                <osztaly>Madarak</osztaly>
                <rend>Pingvinalakúak</rend>
                <csalad>Pingvinfélék</csalad>
                <faj>Császárpingvin</faj>
            </faj>
            <szuletes-ideje>
                2013.07.11.
            </szuletes-ideje>
        </allat>
        <allat aid="a-12" eid="e-4">
            <nev>Zsolti</nev>
            <nem>Hím</nem>
            <faj>
                <orszag>Állatok</orszag>
                <torzs>Gerinchúrosok</torzs>
                <osztaly>Madarak</osztaly>
                <rend>Pingvinalakúak</rend>
                <csalad>Úszólábúak</csalad>
                <faj>Fóka</faj>
            </faj>
            <szuletes-ideje>
                2015.05.06.
            </szuletes-ideje>
        </allat>
        <allat aid="a-13" eid="e-4">
            <nev>Szandi</nev>
            <nem>Nőstény</nem>
            <faj>
                <orszag>Állatok</orszag>
                <torzs>Gerinchúrosok</torzs>
                <osztaly>Madarak</osztaly>
                <rend>Pingvinalakúak</rend>
                <csalad>Úszólábúak</csalad>
                <faj>Fóka</faj>
            </faj>
            <szuletes-ideje>
                2014.12.05.
            </szuletes-ideje>
        </allat>
        <allat aid="a-14" eid="e-6">
            <nev>Fütyülős</nev>
            <nem>Hím</nem>
            <faj>
                <orszag>Állatok</orszag>
                <torzs>Gerinchúrosok</torzs>
                <osztaly>Madarak</osztaly>
                <rend>Lúdalakúak</rend>
                <csalad>Récefélék</csalad>
                <faj>Tőkés réce</faj>
            </faj>
            <szuletes-ideje>
                2018.03.11.
            </szuletes-ideje>
        </allat>
        <allat aid="a-15" eid="e-1">
            <nem>Nőstény</nem>
            <faj>
                <orszag>Állatok</orszag>
                <torzs>Gerinchúrosok</torzs>
                <osztaly>Madarak</osztaly>
                <rend>Pingvinalakúak</rend>
                <csalad>Pingvinfélék</csalad>
                <faj>Császárpingvin</faj>
            </faj>
            <szuletes-ideje>
                2019.11.15.
            </szuletes-ideje>
        </allat>
        <allat aid="a-16" eid="e-6">
            <nem>Hím</nem>
            <faj>
                <orszag>Állatok</orszag>
                <torzs>Gerinchúrosok</torzs>
                <osztaly>Madarak</osztaly>
                <rend>Lúdalakúak</rend>
                <csalad>Récefélék</csalad>
                <faj>Tőkés réce</faj>
            </faj>
            <szuletes-ideje>
                2019.03.14.
            </szuletes-ideje>
        </allat>
        <allat aid="a-17" eid="e-6">
            <nem>Nőstény</nem>
            <faj>
                <orszag>Állatok</orszag>
                <torzs>Gerinchúrosok</torzs>
                <osztaly>Madarak</osztaly>
                <rend>Lúdalakúak</rend>
                <csalad>Récefélék</csalad>
                <faj>Tőkés réce</faj>
            </faj>
            <szuletes-ideje>
                2019.05.31.
            </szuletes-ideje>
        </allat>
        <allat aid="a-18" eid="e-6">
            <nem>Nőstény</nem>
            <faj>
                <orszag>Állatok</orszag>
                <torzs>Gerinchúrosok</torzs>
                <osztaly>Madarak</osztaly>
                <rend>Lúdalakúak</rend>
                <csalad>Récefélék</csalad>
                <faj>Tőkés réce</faj>
            </faj>
            <szuletes-ideje>
                2017.03.11.
            </szuletes-ideje>
        </allat>
        <allat aid="a-19" eid="e-6">
            <nem>Nőstény</nem>
            <faj>
                <orszag>Állatok</orszag>
                <torzs>Gerinchúrosok</torzs>
                <osztaly>Madarak</osztaly>
                <rend>Lúdalakúak</rend>
                <csalad>Récefélék</csalad>
                <faj>Tőkés réce</faj>
            </faj>
            <szuletes-ideje>
                2016.03.20.
            </szuletes-ideje>
        </allat>
    </allatok>
    <gondozok>
        <gondozo szemelyi-szam="123456AA">
            <nev>Dolgos Jóska</nev>
            <nem>Férfi</nem>
            <fizetes>150000</fizetes>
        </gondozo>
        <gondozo szemelyi-szam="123456BA">
            <nev>Radó Fülöp</nev>
            <nem>Férfi</nem>
            <fizetes>140000</fizetes>
        </gondozo>
        <gondozo szemelyi-szam="654321BA">
            <nev>Nyers Gabriella</nev>
            <nem>Nő</nem>
            <fizetes>140000</fizetes>
        </gondozo>
        <gondozo szemelyi-szam="654323BA">
            <nev>Süveges Krisztina</nev>
            <nem>Nő</nem>
            <fizetes>160000</fizetes>